日付,都道府県,学校種,学校名,試験名,試験地,住所,時間
2026/02/02,福岡県,大学,獨協大学,全学科統一前期・学科別/外検+実施,福岡会場（リファレンスヒューリックスクエア福岡天神）,福岡県福岡市中央区天神2-8-49 ヒューリック福岡ビル 4F・5F,
2026/02/02,福岡県,大学,芝浦工業大学,一般選抜（前期/全学統一）,福岡会場（天神チクモクビル）,福岡県福岡市中央区天神3-10-27,
2026/02/02,福岡県,大学,人間環境大学,特別奨学生・一般I期,福岡会場（福岡ガーデンパレス）,福岡県福岡市中央区天神4-8-15,
2026/02/02,福岡県,大学,武雄アジア大学,一般選抜 前期,福岡試験場,福岡県福岡市中央区天神4-8-15,
2026/02/02,福岡県,大学,徳島文理大学,一般入試会場（詳細要項参照）,福岡市会場　福岡ガーデンパレス,福岡県福岡市中央区天神4丁目8-15,
2026/02/02,福岡県,大学,九州産業大学,一般前期/後期・実技前期,九州産業大学,福岡県福岡市東区松香台2-3-1,
2026/02/02,福岡県,大学,福山大学,一般選抜 前期A・後期,福岡県中小企業振興センター,福岡県福岡市博多区吉塚本町9-15,
2026/02/02,福岡県,大学,福山平成大学,一般選抜A・後期,福岡県中小企業振興センター,福岡県福岡市博多区吉塚本町9-15,
2026/02/02,福岡県,大学,東海大学,医学部一般選抜1次,パピヨン24（ガスホール）,福岡県福岡市博多区千代1-17-1,
2026/02/02,福岡県,大学,東京理科大学,一般選抜B・S方式,福岡試験場（北九州予備校博多駅校）,福岡県福岡市博多区博多駅前1-21-4,
2026/02/02,福岡県,大学,広島女学院大学,一般A、特待生,福岡商工会議所,福岡県福岡市博多区博多駅前2-9-28,
2026/02/02,福岡県,大学,成城大学,S方式（全学部統一選抜）,福岡商工会議所,福岡県福岡市博多区博多駅前2-9-28,
2026/02/02,福岡県,大学,専修大学,,TKPカンファレンスシティ博多,福岡県福岡市博多区博多駅前3-19-5 博多石川ビル1階,
2026/02/02,福岡県,大学,吉備国際大学,一般前期AⅠ/AⅡ/B/C・中期・後期,福岡会場（エイムアテイン博多駅前会議室）,福岡県福岡市博多区博多駅前3-25-24,
2026/02/02,福岡県,大学,九州医療科学大学,総I期・総特待・推A/B・一般前中後,エイムアテイン 博多駅前貸会議室,福岡県福岡市博多区博多駅前3-25-24 八百治ビル5・6階,
2026/02/02,福岡県,大学,大阪商業大学,一般入試 前期,エイムアテイン博多駅前貸会議室,福岡県福岡市博多区博多駅前3-25-24 八百治ビル5階,
2026/02/02,福岡県,大学,金沢工業大学,一般A・B/総合・自己推薦,公務員ビジネス専門学校,福岡県福岡市博多区博多駅前3-29-8,
2026/02/02,福岡県,大学,関西学院大学,全日程（一般/個別/英数/共通併用）,代々木ゼミナール 福岡校,福岡県福岡市博多区博多駅前4-2-25,
2026/02/02,福岡県,大学,國學院大学,一般選抜A日程（地方会場）,福岡会場（博多バスターミナル）,福岡県福岡市博多区博多駅中央街2,
2026/02/02,福岡県,大学,広島修道大学,一般選抜前期A/B/C,博多バスターミナル 9階,福岡県福岡市博多区博多駅中央街2-1,
2026/02/02,福岡県,大学,川崎医療福祉大学,推後A・一般前期B,福岡会場（TKP博多駅筑紫口ビジネスセンター）,福岡県福岡市博多区博多駅中央街4-8 ユーコウビル,
2026/02/02,福岡県,大学,東京歯科大学,一般I・共通テストIの福岡会場,TKP博多駅筑紫口ビジネスセンター（福岡会場）,福岡県福岡市博多区博多駅中央街4-8 ユーコウビル7～9階,
2026/02/02,福岡県,大学,大阪産業大学,一般前期A/B/C,TKP博多駅筑紫口ビジネスセンター,福岡県福岡市博多区博多駅中央街4-8 ユーコウビル8階,
2026/02/02,福岡県,大学,千葉工業大学,A/SA日程サテライト,福岡試験場（TKPガーデンシティ博多新幹線口）,福岡県福岡市博多区博多駅中央街5-14 福さ屋本社ビル,
2026/02/02,福岡県,大学,長崎外国語大学,一般選抜A/スカラシップ,リファレンス駅東ビル 2F,福岡県福岡市博多区博多駅東1-16-14,
2026/02/02,福岡県,大学,徳島文理大学,一般入試会場（詳細要項参照）,福岡市会場　リファレンス駅東ビル,福岡県福岡市博多区博多駅東1丁目16-14,
2026/02/02,福岡県,大学,東京都市大学,一般選抜 前期・中期,福岡会場（OHI 八重洲博多ビル 貸会議室）,福岡県福岡市博多区博多駅東2-18-30,
2026/02/02,福岡県,大学,広島国際大学,一般選抜（手続期間長期型）,福岡会場（八重洲博多ビル）,福岡県福岡市博多区博多駅東2-18-30,
2026/02/02,福岡県,大学,京都先端科学大学,公募推薦A、一般A・B,八重洲博多ビル,福岡県福岡市博多区博多駅東2丁目18-30,
2026/02/02,福岡県,大学,広島工業大学,一般選抜A日程,福岡会場（八重洲博多ビル）,福岡県福岡市博多区博多駅東2丁目18-30,
2026/02/02,福岡県,大学,宇部フロンティア大学,一般選抜A日程（地方会場）,福岡会場,福岡県福岡巿博多区博多駅前3-25-24,
2026/02/02,福岡県,大学,福岡大学,一般選抜（系統別・前期）,北九州会場（毎日西部会館）,福岡県北九州市小倉北区紺屋町 13-1 毎日西部会館,
2026/02/02,福岡県,大学,広島修道大学,一般選抜前期A/B/C,毎日西部会館（（株）毎日ビルディング）,福岡県北九州市小倉北区紺屋町13-1,
2026/02/02,福岡県,大学,中村学園大学,一般選抜A方式・短大一般,北九州会場,福岡県北九州市小倉北区堺町1丁目6-13,
2026/02/02,福岡県,大学,関西学院大学,全学部日程のみ（小倉）,北九州予備校 小倉駅校,福岡県北九州市小倉北区浅野1丁目3-27,
2026/02/02,福岡県,大学,福山平成大学,一般選抜 前期A日程（小倉）,小倉試験場,福岡県北九州市小倉北区浅野2-14-1,
2026/02/02,福岡県,大学,吉備国際大学,一般前期AⅠ/AⅡ/B/C,北九州会場（TKP小倉駅前カンファレンスセンター）,福岡県北九州市小倉北区浅野2-14-2,
2026/02/02,福岡県,大学,九州医療科学大学,総特待・推B・一般前/中,TKP小倉駅前 カンファレンスセンター,福岡県北九州市小倉北区浅野2-14-2 小倉興産16号館8・9階,
2026/02/02,福岡県,大学,名城大学,一般選抜 地区別会場,アーバン・オフィス天神,福岡市中央区天神1-3-38 天神121ビル13階,
2026/02/02,福岡県,大学,中部大学,前期A/B・共通テ+,福岡県中小企業振興センター,福岡市博多区吉塚本町9-15,
2026/02/02,福岡県,大学,亜細亜大学,全学統一入試 前期,福岡会場（アクア博多）,福岡市博多区中洲5丁目3-8,
2026/02/02,福岡県,大学,立命館アジア太平洋大学,スタンダード3/英語重視/共テ+英・国/後期,博多国際展示場＆カンファレンスセンター,福岡市博多区東光2-22-15,
2026/02/02,福岡県,大学,立命館大学,一般選抜（試験地）,博多国際展示場＆カンファレンスセンター,福岡市博多区東光2-22-15,
2026/02/02,福岡県,大学,就実大学,一般選抜A・B日程,福岡会場（リファレンス大博多ビル貸会議室）,福岡市博多区博多駅前2丁目20-1,
2026/02/02,福岡県,大学,玉川大学,全学統一等（2/2-2/3のみ）,福岡会場（代々木ゼミナール）,福岡市博多区博多駅前4-2-25,
2026/02/02,福岡県,大学,日本医科大学,一般選抜 前期1次 福岡会場,リファレンス駅東ビル5階,福岡市博多区博多駅東1丁目16-14 リファレンス駅東ビル5階,
2026/02/02,兵庫県,大学,兵庫医科大学,薬・看・リハ 一般(前期A/B・中・後期),神戸キャンパス会場,兵庫県神戸市中央区港島1丁目3-6,
2026/02/02,兵庫県,大学,関西大学,,神戸国際会議場,兵庫県神戸市中央区港島中町6丁目9-1 神戸国際交流会館,
2026/02/02,兵庫県,大学,大阪産業大学,一般前期A/B/C,神戸駅前研修センター,兵庫県神戸市中央区中町通2丁目3-1 SK HOTEL神戸駅前内,
2026/02/02,兵庫県,大学,関西大学,,三宮研修センター,兵庫県神戸市中央区八幡通4丁目2-12 カサベラFRⅡビル,
2026/02/02,兵庫県,大学,関西大学,,神戸サンボーホール,兵庫県神戸市中央区浜辺通5丁目1-32,
2026/02/02,兵庫県,大学,関西学院大学,全日程（一般/個別/英数/共通併用）,関西学院大学 西宮上ケ原キャンパス（本学）,兵庫県西宮市上ケ原一番町1-155,
2026/02/02,兵庫県,大学,九州医療科学大学,総特待・推B・一般前期,吉備国際大学 南あわじ志知キャンパス,兵庫県南あわじ市志知佐礼尾370-1,
2026/02/02,兵庫県,大学,吉備国際大学,一般前期AⅠ/AⅡ/B/C,南あわじ会場（南あわじ志知キャンパス）,兵庫県南あわじ市志知佐礼尾370-1,
2026/02/02,兵庫県,大学,就実大学,一般選抜A・B日程,姫路会場（Office ADOCK）,兵庫県姫路市駅前町222,
2026/02/02,兵庫県,大学,大阪産業大学,一般前期A/B/C,姫路商工会議所,兵庫県姫路市下寺町43,
2026/02/02,兵庫県,大学,関西大学,,姫路商工会議所,兵庫県姫路市下寺町43,
2026/02/02,兵庫県,大学,吉備国際大学,一般前期AⅠ/AⅡ/B/C,姫路会場（姫路キャッスルグランヴィリオホテル）,兵庫県姫路市三左衛門堀西の町210,
2026/02/02,兵庫県,大学,九州医療科学大学,一般選抜前期,姫路キヤッスルグランヴィリオホテル,兵庫県姫路市三左衛門堀西の町210番地,
2026/02/02,兵庫県,大学,関西学院大学,全日程（一般/個別/英数/共通併用）,兵庫県立武道館,兵庫県姫路市西延末504番地,
2026/02/02,兵庫県,大学,関西学院大学,全学部日程のみ（姫路）,姫路・西はりま地場産業センター,兵庫県姫路市南駅前町123番,
2026/02/02,兵庫県,大学,大阪産業大学,公募推薦前期,BIZ SPACE 姫路,兵庫県姫路市本町127番地 大手前ダイネンBLD.Ⅱ,
2026/02/02,兵庫県,大学,金沢工業大学,一般試験A,BIZ SPACE 姫路,兵庫県姫路市本町127番地 大手前ダイネンBLD.II,
2026/02/02,兵庫県,大学,大阪産業大学,一般前期A/B/C,宝塚商工会議所,兵庫県宝塚市栄町2-1-2 ソリオ2（6階）,
2026/02/02,福岡県,大学,福山大学,一般選抜 前期A日程（小倉）,KMMビル,北九州市小倉北区浅野2-14-1,
2026/02/02,福岡県,大学,立命館アジア太平洋大学,スタンダード3,北九州国際会議場,北九州市小倉北区浅野3-9-30,
2026/02/02,福岡県,大学,立命館大学,一般選抜（試験地）,北九州国際会議場,北九州市小倉北区浅野3-9-30,
2026/02/02,和歌山県,大学,大阪商業大学,一般入試 前期,学校法人 大原学園 和歌山校 2号館,和歌山県和歌山市黒田108-1,
2026/02/02,和歌山県,大学,徳島文理大学,一般入試会場（詳細要項参照）,和歌山市会場　大原簿記法律＆美容製菓専門学校和歌山校,和歌山県和歌山市黒田88-1,
2026/02/02,和歌山県,大学,関西学院大学,全学部日程のみ,和歌山ビッグウエーブ,和歌山県和歌山市手平2-1-1,
2026/02/02,和歌山県,大学,阪南大学,一般前期,和歌山県民文化会館,和歌山県和歌山市小松原通1-1,
2026/02/02,和歌山県,大学,大阪産業大学,一般前期A/B/C,和歌山英数学館 2号館,和歌山県和歌山市太田2-13-7,
2026/02/02,和歌山県,大学,関西大学,,和歌山英数学館,和歌山県和歌山市太田2丁目13-12,
2026/02/02,和歌山県,大学,立命館アジア太平洋大学,スタンダード3,ホテルアバローム紀の国,和歌山市湊通丁北2-1-2,
2026/02/02,和歌山県,高等学校,羽衣学園,,和歌山,和歌山市湊通丁北2-1-2 ,
2026/02/02,和歌山県,大学,立命館大学,一般選抜（試験地）,ホテルアバローム紀の国,和歌山市湊通丁北2-1-2,
2026/02/02,大阪府,大学,立命館アジア太平洋大学,スタンダード3/英語重視/共テ+英・国/後期,立命館大学（大阪いばらきキャンパス）,茨木市岩倉町2-150,
2026/02/02,大阪府,大学,立命館大学,一般選抜（試験地）,立命館大学（大阪いばらきキャンパス）,茨木市岩倉町2-150,
2026/02/02,高知県,大学,徳島文理大学,一般入試会場（詳細要項参照）,四万十市会場　新ロイヤルホテル四万十,四万十市中村小姓町26,
2026/02/02,岡山県,大学,森ノ宮医療大学,一般前期C,岡山会場（TKPガーデンシティ岡山）,岡山県岡山市北区中山下1-8-45NTTクレド岡山ビル,
2026/02/02,京都府,大学,佛教大学,一般選抜（Ｂ日程）,京都（本学）会場（佛教大学 紫野キャンパス）,京都市北区紫野北花ノ坊町96,
2026/02/02,京都府,大学,佛教大学,一般選抜（Ｂ日程）,福知山市厚生会館,京都府福知山市中ノ170-5,
2026/02/02,熊本県,大学,東海大学,全学部統一前期,熊本,熊本県熊本市東区渡鹿9-1-1,
2026/02/02,広島県,大学,森ノ宮医療大学,一般前期B,広島会場（TKP広島本通駅前カンファレンスセンター ）,広島県広島市中区紙屋町2-2-12 信和広島ビル,
2026/02/02,広島県,大学,森ノ宮医療大学,一般前期C,広島会場（TKP広島本通駅前カンファレンスセンター ）,広島県広島市中区紙屋町2-2-12 信和広島ビル,
2026/02/02,広島県,大学,東海大学,全学部統一前期,広島,広島県広島市中区大手町4-7-3,
2026/02/02,広島県,大学,名古屋外国語大学,一般選抜前期Ｍ3方式、一般選抜前期Ｍ2方式,ワークピア広島,広島県広島市南区金屋町1-17,
2026/02/02,広島県,大学,川崎医療福祉大学,一般選抜前期 [B日程],広島会場（TKP広島本通駅前カンファレンスセンター）,広島市中区紙屋町2-2-12 信和広島ビル,
2026/02/02,広島県,大学,佛教大学,一般選抜（Ｂ日程）,TKP広島本通駅前カンファレンスセンター,広島市中区紙屋町2丁目2-12信和広島ビル3階,
2026/02/02,香川県,大学,佛教大学,一般選抜（Ｂ日程）,高松センタービル,高松市寿町2-4-20,
2026/02/02,香川県,大学,川崎医療福祉大学,一般選抜前期 [B日程],高松会場（ホテルマリンパレスさぬき）,高松市福岡町2-3-4,
2026/02/02,高知県,大学,川崎医療福祉大学,一般選抜前期 [B日程],高知会場（高知共済会館 COMMUNITY SQUARE）,高知市本町5-3-20,
2026/02/02,山口県,大学,川崎医療福祉大学,一般選抜前期 [B日程],山口会場（セントコア山ロ）,山ロ市湯田温泉3-2-7,
2026/02/02,鹿児島県,大学,東海大学,全学部統一前期,鹿児島,鹿児島県鹿児島市山之口町2-7,
2026/02/02,愛媛県,大学,川崎医療福祉大学,一般選抜前期 [B日程],松山会場（ホテルサンルート松山）,松山市宮田町391-8,
2026/02/02,兵庫県,大学,佛教大学,一般選抜（Ｂ日程）,ラッセホール,神戸市中央区中山手通4丁目10-8,
2026/02/02,大阪府,大学,愛知学院大学,,大阪,大阪市福島区福島6-22-20,
2026/02/02,大阪府,大学,佛教大学,一般選抜（Ｂ日程）,梅田センタービル クリスタルホール,大阪市北区中崎西2-4-12,
2026/02/02,大阪府,大学,川崎医療福祉大学,一般選抜前期 [B日程],大阪会場（TKP新大阪ビジネスセンター）,大阪市淀川区西中島5-13-9,
2026/02/02,大阪府,大学,名古屋外国語大学,一般選抜前期Ｍ3方式、一般選抜前期Ｍ2方式,大阪御堂筋ビル地下4階　貸会議室,大阪府大阪市中央区久太郎町4-1-3,
2026/02/02,岡山県,大学,川崎医療福祉大学,一般選抜前期 [B日程],津山会場（津山中央病院 医療研修センター）,津山市川崎1756,
2026/02/02,兵庫県,大学,川崎医療福祉大学,一般選抜前期 [B日程],姫路会場（BIZ SPACE HIMEJI）,姫路市本町127 大手前ダイネンBLD.Ⅱ,
2026/02/02,福岡県,大学,名古屋外国語大学,一般選抜前期Ｍ3方式、一般選抜前期Ｍ2方式,天神ビル,福岡県福岡市中央区天神2-12-1,
2026/02/02,福岡県,大学,愛知学院大学,,福岡,福岡市中央区天神2丁目12番1,
2026/02/02,福岡県,大学,佛教大学,一般選抜（Ｂ日程）,福岡ファッションビル FFBホール,福岡市博多区博多駅前2-10-19,
2026/02/02,福岡県,大学,川崎医療福祉大学,一般選抜前期 [B日程],福岡会場（TKP博多駅前シティセンター）,福岡市博多区博多駅前3-2-1,
2026/02/02,滋賀県,大学,佛教大学,一般選抜（Ｂ日程）,滋賀県立文化産業交流会館,米原市下多良2丁目137,
2026/02/02,鳥取県,大学,佛教大学,一般選抜（Ｂ日程）,国際ファミリープラザ,米子市加茂町2-180,
2026/02/02,鳥取県,大学,川崎医療福祉大学,一般選抜前期 [B日程],米子会場（スマイルホテル米子）,米子市西福原1-1-55,
2026/02/02,和歌山県,大学,佛教大学,一般選抜（Ｂ日程）,和歌山城ホール,和歌山市七番丁25番1,
