日付,都道府県,学校種,学校名,試験名,試験地,住所,時間
2026/01/31,東京都,大学,つくば国際大学,,東京,東京都中央区八重洲1-8-17新槇町ビル7F,
2026/01/31,愛知県,国家試験,愛知学院大学 日進キャンパス,歯科医師,,愛知県日進市岩崎町阿良池12,
2026/01/31,愛知県,大学,岡山理科大学,一般入試前期B日程,名古屋,愛知県名古屋市中村区名駅4-7-1」ミッドランドスクエア オフィスタワー5F ミッドランドスクエア（ミッドランドホール）,10:00-12:00　開場9:00
2026/01/31,静岡県,大学,岡山理科大学,一般入試前期B日程,静岡,静岡県静岡市駿河区八幡1-1-1 静岡学園なごみ高等学校,10:00-12:00　開場9:00
2026/01/31,石川県,大学,岡山理科大学,一般入試前期B日程,金沢,石川県金沢市尾山町9-13 金沢商工会議所,10:00-12:00　開場9:00
2026/01/31,東京都,大学,岡山理科大学,一般入試前期B日程,東京,東京都中央区京橋3-1-1 京橋スクエアガーデン5F 東京コンベンションホール,10:00-12:00　開場9:00
2026/01/31,東京都,大学,岩手医科大学,医学部地域枠,ベルサール神田,東京都千代田区神田美土代町7,
2026/01/31,愛知県,大学,岐阜医療科学大学,一般選抜前期,名古屋,愛知県名古屋市中村区則武1-6-3 ベルヴュオフィス名古屋1～3階 TKPガーデンシティPREMIUM名駅西口,
2026/01/31,静岡県,大学,岐阜医療科学大学,一般選抜前期,静岡,静岡県静岡市駿河区南町11-29 サンパレスホテル,
2026/01/31,静岡県,大学,岐阜医療科学大学,一般選抜前期,浜松,静岡県浜松市中央区連沢町309番地11 秀英予備校 浜松本部校,
2026/01/31,石川県,大学,岐阜医療科学大学,一般選抜前期,金沢,石川県金沢市広岡二丁目13番33号 JR金沢駅西第三NKビル 2F-3F TKPガーデンシティPREMIUM金沢駅西口,
2026/01/31,長野県,大学,岐阜医療科学大学,一般選抜前期,松本,長野県松本市大手4丁目8-9 松本ホテル花月,
2026/01/31,東京都,大学,岐阜医療科学大学,一般選抜前期,東京,東京都中央区八重洲1-8-16 新槇町ビル TKP東京駅カンファレンスセンター,
2026/01/31,富山県,大学,岐阜医療科学大学,一般選抜前期,富山,富山県富山市奥田新町8-1 ボルファートとやま,
2026/01/31,福井県,大学,岐阜医療科学大学,一般選抜前期,福井,福井県福井市大手3-12-20 ザ・グランユアーズフクイ,
2026/01/31,群馬県,高等学校,共愛学園,,本校,群馬県前橋市小屋原町1115-3,
2026/01/31,群馬県,高等学校,桐生第一,,本校,群馬県桐生市小曽根町1番5号,
2026/01/31,愛知県,大学,甲南大学,,名古屋,愛知県名古屋市東区葵3-7-14,
2026/01/31,群馬県,高等学校,高崎商科大学附属,,本校,群馬県高崎市大橋町237-1,
2026/01/31,岐阜県,高等学校,高山西,,本校,岐阜県高山市下林町353,
2026/01/31,北海道,国家試験,札幌コンベンションセンター,歯科医師,,北海道札幌市白石区東札幌6条1-1-1,
2026/01/31,千葉県,中学校,志学館,,本校,千葉県木更津市真舟3-29-1,
2026/01/31,東京都,国家試験,実践女子大学 渋谷キャンパス,歯科医師,,東京都渋谷区東1-1-49,
2026/01/31,群馬県,高等学校,常磐,,本校,群馬県太田市飯塚町141-1,
2026/01/31,茨城県,大学,神奈川工科大学,一般入試A日程入試,水戸,茨城県水戸市泉町2-3-2 中央ビル,10:00-16:20　入室開始8:40
2026/01/31,宮城県,大学,神奈川工科大学,一般入試A日程入試,仙台,宮城県仙台市青葉区五橋2-11-1 ショーケー本館ビル,10:00-16:20　入室開始8:40
2026/01/31,群馬県,大学,神奈川工科大学,一般入試A日程入試,高崎,群馬県高崎市栄町15-3 小野池学院,10:00-16:20　入室開始8:40
2026/01/31,山梨県,大学,神奈川工科大学,一般入試A日程入試,甲府,山梨県甲府市武田1-3-27 甲斐大学予備校（北館）,10:00-16:20　入室開始9:00
2026/01/31,新潟県,大学,神奈川工科大学,一般入試A日程入試,新潟,新潟県新潟市中央区天神1-1 プラーカ3 B1F NINNO3会議室,10:00-16:20　入室開始9:00
2026/01/31,神奈川県,大学,神奈川工科大学,一般入試A日程入試,横浜,神奈川県横浜市西区北幸2-5-15 プレミア横浜西口ビル ビジョンセンター横浜,10:00-16:20　入室開始9:00
2026/01/31,静岡県,大学,神奈川工科大学,一般入試A日程入試,沼津,静岡県沼津市大手町1-1-4 プラサヴェルデ,10:00-16:20　入室開始9:00
2026/01/31,静岡県,大学,神奈川工科大学,一般入試A日程入試,静岡,静岡県静岡市駿河区八幡1-1-1 静岡学園なごみ高等学校,10:00-16:20　入室開始8:40
2026/01/31,長野県,大学,神奈川工科大学,一般入試A日程入試,長野,長野県長野市北石堂町1022 信学会駿台提携長野予備学校,10:00-16:20　入室開始9:00
2026/01/31,東京都,大学,神奈川工科大学,一般入試A日程入試,東京,東京都中央区京橋1-10-7 KPP八重洲ビル7F(AP東京八重洲),10:00-16:20　入室開始9:00
2026/01/31,東京都,大学,神奈川工科大学,一般入試A日程入試,立川,東京都立川市曙町2-38-5 立川ビジネスセンタービル11階 立川商工会議所,10:00-16:20　入室開始9:00
2026/01/31,栃木県,大学,神奈川工科大学,一般入試A日程入試,宇都宮,栃木県宇都宮市本町1-8 栃木県総合文化センター,10:00-16:20　入室開始9:00
2026/01/31,東京都,,菅生学園初等学校,,,東京都あきる野市菅生1468,
2026/01/31,茨城県,中学校,清真学園中学校,後期,,茨城県鹿嶋市宮中伏見4448-5,
2026/01/31,宮城県,国家試験,仙台卸商センター サンフェスタ・卸町会館,歯科医師,仙台卸商センター サンフェスタ・卸町会館,宮城県仙台市若林区卸町2-15-2,
2026/01/31,群馬県,高等学校,前橋育英,,本校,群馬県前橋市朝日が丘町13,
2026/01/31,岐阜県,高等学校,多治見西,,本校,岐阜県多治見市明和町1-18,
2026/01/31,岐阜県,高等学校,中京,,本校,岐阜県瑞浪市土岐町7074-1,
2026/01/31,岐阜県,高等学校,帝京大学可児,,本校,岐阜県可児市桂ケ丘一丁目1番地,
2026/01/31,東京都,国家試験,電気通信大学,歯科医師,,東京都調布市調布ケ丘1-5-1,
2026/01/31,愛知県,中学校,東海中学校,,,名古屋市東区筒井一丁目2-35,
2026/01/31,愛知県,,南山　男子部,,,愛知県名古屋市昭和区五軒家町6,
2026/01/31,新潟県,国家試験,日本歯科大学 新潟生命歯学部,歯科医師,,新潟県新潟市中央区浜浦町1-8,
2026/01/31,栃木県,高等学校,白鴎大学足利,,本校,栃木県足利市伊勢南町3-2,
2026/01/31,福島県,,福島成蹊,,,福島県福島市腰浜町15番21号,
2026/01/31,北海道,大学,北海道医療大学,前期,札幌,札幌市中央区北4条西5丁目,
2026/01/31,北海道,大学,北海道医療大学,前期,旭川,旭川市4条通9丁目1703,
2026/01/31,北海道,大学,北海道医療大学,前期,帯広,帯広市西6条南6丁目3,
2026/01/31,北海道,大学,北海道医療大学,前期,北見,北見市とん田東町617-139,
2026/01/31,北海道,大学,北海道医療大学,前期,函館,函館市若松町6-3,
2026/01/31,青森県,大学,北海道医療大学,前期,青森,青森県青森市本町3丁目3-11,
2026/01/31,秋田県,大学,北海道医療大学,前期,秋田,秋田市中通4-3-32,
2026/01/31,宮城県,大学,北海道医療大学,前期,仙台,仙台市青葉区1番町1丁目4-8,
2026/01/31,東京都,大学,北海道医療大学,前期,東京,東京都新宿区百人町2丁目8-15,
2026/01/31,岐阜県,高等学校,麗澤瑞浪,,本校,岐阜県瑞浪市稲津町萩原1661,
2026/01/31,東京都,大学,龍谷大学,一般,東京,東京都千代田区有楽町1-5-1 日比谷マリンビル3階,
2026/01/31,石川県,大学,龍谷大学,一般,金沢,金沢市広岡1丁目1-15,
2026/01/31,福井県,大学,龍谷大学,一般,福井,福井県福井市田原1丁目13番6号,
2026/01/31,静岡県,大学,龍谷大学,一般,浜松,浜松市中央区砂山町1107,
2026/01/31,愛知県,大学,龍谷大学,一般,名古屋,名古屋市千種区内山3-23-12,
2026/01/31,三重県,大学,龍谷大学,一般,津,津市栄町一丁目891,
