日付,都道府県,学校種,学校名,試験名,試験地,住所,時間
2026/02/03,山形県,高等学校,山形県立小国高等学校,,前期Ｂ,山形県西置賜郡小国町大字岩井沢621,
2026/02/03,山形県,大学,開志専門職大学,一般選抜,東京第一ホテル鶴岡,山形県鶴岡市錦町2-10,
2026/02/03,山形県,高等学校,山形県立致道館高等学校,,前期Ｂ,山形県鶴岡市若葉町26番31号,
2026/02/03,山形県,大学,東北福祉大学,A日程統一・分割,鶴岡市勤労者会館,山形県鶴岡市泉町8-57,
2026/02/03,山形県,高等学校,山形県立東桜学館高等学校,,前期Ｂ,山形県東根市中央南一丁目7番1号,
2026/02/03,山形県,高等学校,山形県立米沢興譲館高等学校,,前期Ｂ,山形県米沢市大字笹野1101,
2026/02/03,山梨県,大学,山梨学院大学,一般選抜（個別）前期・後期、ILA本学,本学会場（山梨学院大学）,山梨県甲府市酒折2-4-5,
2026/02/03,山梨県,大学,千葉工業大学,A/SA・B/SB日程サテライト,甲府試験場（甲斐大学予備校）,山梨県甲府市武田1-2-20,
2026/02/03,三重県,大学,金城学院大学,推薦と一般選抜前期,四日市会場,四日市市安島1-3-18,
2026/02/03,三重県,大学,中京大学,一般前期A/M・後期F／総合型・推薦,四日市商工会議所,四日市市諏訪町2-5,
2026/02/03,秋田県,大学,日本赤十字東北看護大学,総合型・学校推薦・一般/前期B,本学キャンパス（日本赤十字東北看護大学）,秋田県秋田市上北手猿田字苗代沢17-3,
2026/02/03,秋田県,大学,東北福祉大学,A日程統一・分割,秋田予備校,秋田県秋田市中通4-3-32,
2026/02/03,秋田県,大学,八戸工業大学,一般前期・推薦（指定校等）,秋田会場（秋田拠点センター アルヴェ）,秋田市東通仲町4-1,
2026/02/03,千葉県,大学,玉川大学,全学統一等（2/2-2/3のみ）,千葉会場（千葉工業大学）,習志野市津田沼2-17-1,
2026/02/03,長野県,大学,中京大学,一般前期A/M・後期F／総合型・推薦,ホテルモンターニュ松本,松本市巾上3-2,
2026/02/03,長野県,大学,名城大学,一般選抜 地区別会場,松本市駅前会館　松本市歯科医師会館,松本市深志2-3-21,
2026/02/03,長野県,大学,山梨学院大学,一般選抜（個別）前期（松本）,松本会場　信州予備学校,松本市深志2-4-1,
2026/02/03,新潟県,大学,金沢星稜大学,一般A日程,上越会場,新潟県上越市中央1-2-7,
2026/02/03,新潟県,大学,千葉工業大学,A/SA・B/SB日程サテライト,新潟試験場（GARESSO HALL）,新潟県新潟市中央区花園1-2-2 コープシティ花園「ガレッソ」4階,
2026/02/03,新潟県,大学,日本福祉大学,一般入学試験 前期,新潟会場（日本こども福祉専門学校）,新潟県新潟市中央区花園1-4-8,
2026/02/03,新潟県,大学,東京農業大学,一般選抜A日程,看護リハビリ新潟保健医療専門学校（新潟会場）,新潟県新潟市中央区花園2-2-19,
2026/02/03,新潟県,大学,群馬医療福祉大学,一般選抜 前期,新潟会場,新潟県新潟市中央区笹口1-1 アートホテル新潟駅前,
2026/02/03,新潟県,大学,開志専門職大学,一般選抜,開志専門職大学 紫竹山キャンパス,新潟県新潟市中央区紫竹山6丁目3番5号,
2026/02/03,新潟県,大学,淑徳大学,一般選抜A・9月総合型選抜,新潟試験場（NINNO3会議室）,新潟県新潟市中央区天神1丁目1 プラーカ3 B1F,
2026/02/03,新潟県,大学,福井工業大学,一般Ⅰ期,NST新潟総合テレビ,新潟県新潟市中央区八千代2-3-1,
2026/02/03,新潟県,大学,國學院大学,一般選抜A日程（地方会場）,新潟会場（代々木ゼミナール新潟校）,新潟県新潟市中央区弁天1-4-18,
2026/02/03,新潟県,大学,立正大学,一般選抜2月前期（2/3のみ）,新潟会場（代々木ゼミナール新潟校）,新潟県新潟市中央区弁天1-4-18,
2026/02/03,新潟県,大学,関東学院大学,総合型/給費生/一般前期A/後期,代々木ゼミナール 新潟校,新潟県新潟市中央区弁天1-4-18,
2026/02/03,新潟県,大学,高崎健康福祉大学,一般A日程,代々木ゼミナール新潟校,新潟県新潟市中央区弁天1-4-18,
2026/02/03,新潟県,大学,上武大学,一般選抜 全学統一,新潟会場（万代シルバーホテル）,新潟県新潟市中央区万代1-3-30,
2026/02/03,新潟県,大学,東京電機大学,一般選抜 前期/英語外部/情報系外部,代々木ゼミナール 新潟校,新潟市中央区弁天1-4-18,
2026/02/03,新潟県,大学,玉川大学,全学統一等（2/2-2/3のみ）,新潟会場（新潟日報メディアシップ）,新潟市中央区万代3-1-1,
2026/02/03,神奈川県,大学,関東学院大学,総合型/給費生/一般前期A/後期,関東学院大学 横浜・金沢八景キャンパス,神奈川県横浜市金沢区六浦東1-50-1,
2026/02/03,神奈川県,大学,明治学院大学,一般選抜：全学部日程・A日程,横浜キャンパス,神奈川県横浜市戸塚区上倉田町1518,
2026/02/03,神奈川県,大学,立正大学,一般選抜2月前期（2/3-5）,横浜会場（駿台予備学校横浜校1号館）,神奈川県横浜市神奈川区鶴屋町2-23-7,
2026/02/03,神奈川県,大学,北里大学,医学部 第一次試験,パシフィコ横浜ノース,神奈川県横浜市西区みなとみらい1-1-2,
2026/02/03,神奈川県,大学,東京農業大学,一般選抜A日程,TKPガーデンシティPREMIUM横浜ランドマークタワー（横浜会場A）,神奈川県横浜市西区みなとみらい2-2-1 横浜ランドマークタワー25F,
2026/02/03,神奈川県,大学,東海大学,医学部一般選抜1次,TKPガーデンシティPREMIUMみなとみらい,神奈川県横浜市西区みなとみらい3-6-3 MMパークビル5-6F,
2026/02/03,神奈川県,大学,成蹊大学,E方式・P方式独自試験,横浜会場　横浜ベイシェラトンホテル＆タワーズ,神奈川県横浜市西区北幸1-3-23,
2026/02/03,神奈川県,大学,千葉工業大学,A/SA・B/SB日程サテライト,横浜試験場（AP横浜）,神奈川県横浜市西区北幸2-6-1 ONEST横浜西口ビル6階,
2026/02/03,神奈川県,大学,芝浦工業大学,一般選抜（前期/全学統一）,横浜会場（ビジョンセンター横浜）,神奈川県横浜市西区北幸2丁目5-15 プレミア横浜西口ビル,
2026/02/03,神奈川県,大学,國學院大学,一般選抜A日程・B日程,横浜たまプラーザキャンパス,神奈川県横浜市青葉区新石川三丁目22-1,
2026/02/03,神奈川県,大学,星槎道都大学,関東(横浜)会場,星槎大学大学院（横浜情報文化センター5階）,神奈川県横浜市中区日本大通11番 横浜情報文化センター5階,
2026/02/03,神奈川県,大学,関東学院大学,総合型/給費生/一般前期A,関東学院大学 横浜・関内キャンパス,神奈川県横浜市中区万代町1-1-1,
2026/02/03,神奈川県,大学,湘南工科大学,一般選抜（全学部統一・S・前期・中後期）,本学（湘南工科大学）,神奈川県藤沢市辻堂西海岸1-1-25,
2026/02/03,神奈川県,大学,東海大学,医学部一般選抜1次,湘南キャンパス,神奈川県平塚市北金目4-1-1,
2026/02/03,茨城県,大学,玉川大学,全学統一等（2/2-2/3のみ）,水戸会場（MYM ビル）,水戸市宮町1-2,
2026/02/03,茨城県,大学,東京電機大学,一般選抜 前期/英語外部/情報系外部,駿優教育会館,水戸市三の丸1-1-42,
2026/02/03,岩手県,大学,八戸工業大学,一般前期・推薦（指定校等）,盛岡会場（いわて県民情報交流センター(アイーナ)）,盛岡市盛岡駅西通1-7-1,
2026/02/03,青森県,大学,東北福祉大学,A日程統一・分割,アスパム,青森県青森市安方1-1-40,
2026/02/03,青森県,大学,北海道文教大学,一般選抜A日程 青森会場,ハートピアローフク（青森県労働福祉会館）,青森県青森市本町3丁目3-11,
2026/02/03,青森県,大学,札幌学院大学,一般A・B日程,青森県労働福祉会館（ハートピアローフク）,青森県青森市本町3丁目3-11,
2026/02/03,青森県,大学,東北福祉大学,A日程統一・分割,ユートリー・VISIT はちのへ,青森県八戸市一番町1-9-22,
2026/02/03,青森県,大学,八戸工業大学,一般前期/後期・総合・推薦・特別,本学キャンパス,青森県八戸市大字妙字大開88-1,
2026/02/03,青森県,大学,八戸工業大学,一般前期・推薦（指定校等）,青森会場（リンクステーションホール青森）,青森市堤町1-4-1,
2026/02/03,静岡県,高等学校,常葉大学附属菊川,文理ｺｰｽ,本校,静岡県菊川市半済1550,
2026/02/03,静岡県,高等学校,御殿場西,ﾌﾛﾝﾃｨｱ探究ｺｰｽ進学選抜,本校,静岡県御殿場市ぐみ沢644-1,
2026/02/03,静岡県,大学,淑徳大学,一般選抜A,三島試験会場（三島商工会議所）,静岡県三島市一番町2-29,
2026/02/03,静岡県,高等学校,日本大学三島,総合進学ｺｰｽ,本校,静岡県三島市文教町2-31-145,
2026/02/03,静岡県,高等学校,知徳,大進ｺｰｽ,本校,静岡県駿東郡長泉町竹原354,
2026/02/03,静岡県,高等学校,加藤学園暁秀,特進ｺｰｽ,本校,静岡県沼津市岡宮字中見代1361-1,
2026/02/03,静岡県,高等学校,桐陽,英数進学ｺｰｽ,本校,静岡県沼津市高島本町8-52,
2026/02/03,静岡県,高等学校,誠恵,ｽﾀﾝﾀﾞｰﾄﾞ,本校,静岡県沼津市沼北町2-9-12,
2026/02/03,静岡県,高等学校,沼津中央,普通,本校,静岡県沼津市杉崎町11-20,
2026/02/03,静岡県,高等学校,加藤学園,αｺｰｽ,本校,静岡県沼津市大岡自由ヶ丘1979,
2026/02/03,静岡県,高等学校,飛龍,総合ｽﾎﾟｰﾂｺｰｽ,本校,静岡県沼津市東熊堂491,
2026/02/03,静岡県,高等学校,焼津,総合,本校,静岡県焼津市中港1-1-8,
2026/02/03,静岡県,高等学校,不二聖心女子学院,普通,本校,静岡県裾野市桃園198,
2026/02/03,静岡県,大学,國學院大学,一般選抜A日程（地方会場）,静岡会場（レイアップ御幸町ビル）,静岡県静岡市葵区御幸町11-8,
2026/02/03,静岡県,大学,関東学院大学,総合型/給費生/一般前期A/後期,レイアップ御幸町ビル,静岡県静岡市葵区御幸町11-8,
2026/02/03,静岡県,大学,中京大学,一般前期A/M／総合型・推薦,パルシェ貸会議室,静岡県静岡市葵区黒金町49 静岡駅ビル パルシェ本館7階,
2026/02/03,静岡県,大学,立正大学,一般選抜2月前期（2/3のみ）,静岡会場（ホテルアソシア静岡）,静岡県静岡市葵区黒金町56,
2026/02/03,静岡県,高等学校,常葉大学附属常葉,普通,本校,静岡県静岡市葵区水落町1番30号,
2026/02/03,静岡県,高等学校,常葉大学附属橘,総合芸術ｺｰｽ,本校,静岡県静岡市葵区瀬名２－１－１,
2026/02/03,静岡県,高等学校,静岡北,普通,本校,静岡県静岡市葵区瀬名５－１４－１,
2026/02/03,静岡県,高等学校,静岡英和女学院,普通,本校,静岡県静岡市葵区西草深町８－１,
2026/02/03,静岡県,高等学校,静岡大成,進学ｺｰｽ,本校,静岡県静岡市葵区鷹匠２－４－１８,
2026/02/03,静岡県,大学,千葉工業大学,A/SA・B/SB日程サテライト,静岡試験場（秀英予備校 静岡本部校1号館）,静岡県静岡市葵区鷹匠2-7-1,
2026/02/03,静岡県,大学,東京農業大学,一般選抜A日程,秀英予備校 静岡本部校（静岡会場）,静岡県静岡市葵区鷹匠2-7-1,
2026/02/03,静岡県,大学,関西大学,,もくせい会館,静岡県静岡市葵区鷹匠3丁目6−1 もくせい会館,
2026/02/03,静岡県,高等学校,静岡学園,教養科学,本校,静岡県静岡市葵区東鷹匠町２５,
2026/02/03,静岡県,大学,成蹊大学,E方式・P方式独自試験,静岡会場　ツインメッセ静岡,静岡県静岡市駿河区曲金3-1-10,
2026/02/03,静岡県,高等学校,静岡聖光学院,普通,本校,静岡県静岡市駿河区小鹿１４４０番地,
2026/02/03,静岡県,大学,芝浦工業大学,一般選抜（前期/全学統一）,静岡会場（グランシップ）,静岡県静岡市駿河区東静岡2-3-1,
2026/02/03,静岡県,大学,聖隷クリストファー大学,奨学生選抜・一般前期,静岡コンベンションアーツセンター グランシップ,静岡県静岡市駿河区東静岡2丁目3-1,
2026/02/03,静岡県,高等学校,城南静岡,ICT,本校,静岡県静岡市駿河区南八幡町１－１,
2026/02/03,静岡県,大学,浜松学院大学,一般選抜A日程 静岡会場,静岡会場（静岡県男女共同参画センター「あざれあ」）,静岡県静岡市駿河区馬渕1丁目17-1,
2026/02/03,静岡県,大学,日本福祉大学,一般入学試験 前期,静岡会場（静岡学園なごみ高等学校）,静岡県静岡市駿河区八幡1-1-1,
2026/02/03,静岡県,高等学校,静岡女子,普通,本校,静岡県静岡市駿河区八幡３丁目６番１号,
2026/02/03,静岡県,高等学校,東海大学付属静岡翔洋,ｱｸｾﾙｺｰｽ,本校,静岡県静岡市清水区折戸３－２０－１,
2026/02/03,静岡県,高等学校,静岡サレジオ,ｿﾌｨｱｺｰｽ,本校,静岡県静岡市清水区中之郷３－２－１,
2026/02/03,静岡県,高等学校,清水国際,普通,本校,静岡県静岡市清水区天神１－４－１,
2026/02/03,静岡県,高等学校,島田樟誠,特別進学ｺｰｽ,本校,静岡県島田市伊太２０７５－１,
2026/02/03,静岡県,高等学校,藤枝順心,ｷｬﾘｱ創造ｺｰｽ,本校,静岡県藤枝市前島２－３－１,
2026/02/03,静岡県,高等学校,藤枝明誠,普通,本校,静岡県藤枝市大洲２－２－１,
2026/02/03,静岡県,高等学校,静清,文理探究,本校,静岡県藤枝市潮８７,
2026/02/03,静岡県,高等学校,磐田東,特別選抜ｺｰｽ,本校,静岡県磐田市見付１８０－５,
2026/02/03,静岡県,大学,中京大学,一般前期A/M・後期F／総合型・推薦,えんてつホール,静岡県浜松市中央区旭町12-1 遠鉄百貨店新館8階,
2026/02/03,静岡県,高等学校,浜松学芸,探究創造,本校,静岡県浜松市中央区下池川町34-3,
2026/02/03,静岡県,大学,星城大学,一般選抜前期Aのみ,浜松会場,静岡県浜松市中央区元城町218-1,
2026/02/03,静岡県,高等学校,浜松修学舎,夢みらい,本校,静岡県浜松市中央区向宿2-20-1,
2026/02/03,静岡県,高等学校,浜松学院興誠,特進ｺｰｽ(Ⅰ類･Ⅱ類),本校,静岡県浜松市中央区高林1-17-2,
2026/02/03,静岡県,高等学校,静岡県西遠女子学園,普通,本校,静岡県浜松市中央区佐藤三丁目２０－１,
2026/02/03,静岡県,高等学校,浜松啓陽,情報ｺﾐｭﾆｹｰｼｮﾝ,本校,静岡県浜松市中央区三幸町４２１,
2026/02/03,静岡県,高等学校,聖隷クリストファー,英数,本校,静岡県浜松市中央区三方原町３４５３,
2026/02/03,静岡県,大学,聖隷クリストファー大学,奨学生選抜・一般前期・一般後期,聖隷クリストファー大学,静岡県浜松市中央区三方原町3453,
2026/02/03,静岡県,高等学校,浜松開誠館,ｸﾞﾛｰﾊﾞﾙｺｰｽ,本校,静岡県浜松市中央区松城町２０７－２,
2026/02/03,静岡県,高等学校,浜松日体,選抜ｺｰｽⅠ類,本校,静岡県浜松市中央区半田山３－３０－１,
2026/02/03,静岡県,大学,名古屋商科大学,一般前期Aほか（要項参照）,浜松会場（アクトシティ浜松コングレスセンター）,静岡県浜松市中央区板屋町111-1,
2026/02/03,静岡県,大学,浜松学院大学,一般選抜A・B日程,浜松会場（浜松学院大学）,静岡県浜松市中央区布橋三丁目2番3号,
2026/02/03,静岡県,大学,日本福祉大学,一般入学試験 前期,浜松会場（秀英予備校浜松本部校）,静岡県浜松市中央区連尺町309番地11,
2026/02/03,静岡県,高等学校,オイスカ浜松国際,普通,本校,静岡県浜松市中央区和地町５８３５番地,
2026/02/03,静岡県,高等学校,浜松聖星,理数ｺｰｽ,本校,静岡県浜松市中央区蜆塚３－１４－１,
2026/02/03,静岡県,大学,中部学院大学,,浜松会場,静岡県浜松市中区中央3-9-1,
2026/02/03,静岡県,大学,椙山女学園大学,一般入試A学外会場（2/3のみ）,浜松会場,静岡県浜松市中区板屋町110-17,
2026/02/03,静岡県,高等学校,星陵,普通,本校,静岡県富士宮市星山１０６８,
2026/02/03,静岡県,高等学校,静岡県富士見,特進ｺｰｽ,本校,静岡県富士市平垣町１－１,
2026/02/03,静岡県,大学,立命館大学,一般選抜（試験地）,レイアップ御幸町ビル,静岡市葵区御幸町11-8 レイアップ御幸町ビル 5・6・7階（受付2階）,
2026/02/03,静岡県,大学,立命館アジア太平洋大学,スタンダード3/英語重視,レイアップ御幸町ビル,静岡市葵区御幸町11-8 レイアップ御幸町ビル5・6・7階（受付2階）,
2026/02/03,静岡県,大学,東京電機大学,一般選抜 前期/英語外部/情報系外部,静岡労政会館,静岡市葵区黒金町5-1 静岡県勤労者総合会館,
2026/02/03,静岡県,大学,立命館アジア太平洋大学,スタンダード3/英語重視/共テ+英・国,クーポール会館,静岡市葵区紺屋町2-2,
2026/02/03,静岡県,大学,立命館大学,一般選抜（試験地）,クーポール会館,静岡市葵区紺屋町2-2,
2026/02/03,静岡県,大学,名城大学,一般選抜 地区別会場,秀英予備校　静岡校,静岡市葵区鷹匠2-7-1,
2026/02/03,静岡県,大学,名城大学,一般選抜 地区別会場,学校法人名古屋大原学園静岡校,静岡市葵区柚木103-1,
2026/02/03,静岡県,大学,玉川大学,全学統一等（2/2-2/3のみ）,静岡会場（ツインメッセ静岡）,静岡市駿河区曲金3−1−10,
2026/02/03,静岡県,大学,山梨学院大学,一般選抜（個別）前期,静岡会場　グランシップ,静岡市駿河区東静岡2-3-1,
2026/02/03,石川県,大学,金沢医科大学,一般選抜前期 一次,本学キャンパス,石川県河北郡内灘町大学1丁目1番地,
2026/02/03,石川県,大学,京都光華大学,基礎学力チャレンジ/一般前期A・B,金沢歌劇座,石川県金沢市下本多町6番丁27番地,
2026/02/03,石川県,大学,金沢星稜大学,総合型・推薦等・一般A日程,本学試験場（金沢星稜大学）,石川県金沢市御所町丑10番地1,
2026/02/03,石川県,大学,関西学院大学,全日程（一般/個別/英数/共通併用）,大原簿記法律観光専門学校 金沢校,石川県金沢市広岡1-1-15,
2026/02/03,石川県,大学,関西大学,,金沢文化ホール,石川県金沢市高岡町15−1,
2026/02/03,石川県,大学,北陸大学,総合型・推薦・一般A/Bの本学会場,北陸大学 太陽が丘キャンパス,石川県金沢市太陽が丘1-1,
2026/02/03,石川県,大学,京都先端科学大学,一般A(2/2-3)・B・C,石川県文教会館,石川県金沢市尾山町10-5,
2026/02/03,石川県,大学,中京大学,一般前期A/M・後期F／総合型・推薦,金沢商工会議所,石川県金沢市尾山町9-13,
2026/02/03,石川県,大学,福井工業大学,一般Ⅰ期・Ⅱ期,金沢商工会議所会館,石川県金沢市尾山町9番13号,
2026/02/03,石川県,大学,芝浦工業大学,一般選抜（前期/全学統一）,金沢会場（TKP新幹線口会議室）,石川県金沢市堀川新町2-1 井門金沢ビル,
2026/02/03,石川県,大学,日本福祉大学,一般入学試験 前期,金沢会場（金沢医療技術専門学校）,石川県金沢市堀川新町7番1号,
2026/02/03,石川県,大学,福井工業大学,一般Ⅰ期,七尾産業福祉センター,石川県七尾市三島町70-1,
2026/02/03,石川県,大学,金城大学,総合型・推薦・一般（後期含む）,本学会場（笠間キャンパス）,石川県白山市笠間町1200番地,
2026/02/03,宮城県,大学,東京電機大学,一般選抜 前期/英語外部/情報系外部,東北福祉大学 仙台駅東口キャンパス,仙台市宮城野区榴岡2-5-26,
2026/02/03,宮城県,大学,玉川大学,全学統一等（2/2-2/3のみ）,仙台会場（TKP 仙台青葉通カンファレンスセンター）,仙台市青葉区一番町2－4－1,
2026/02/03,宮城県,大学,八戸工業大学,一般前期・推薦（指定校等）,仙台会場（TKPガーデンシティPREMIUM仙台西口）,仙台市青葉区花京院1-2-15 ソララプラザ,
2026/02/03,宮城県,大学,立命館アジア太平洋大学,スタンダード3,ハーネル仙台,仙台市青葉区本町2-12-7,
2026/02/03,宮城県,大学,立命館大学,一般選抜（試験地）,ハーネル仙台,仙台市青葉区本町2-12-7,
2026/02/03,東京都,大学,立命館アジア太平洋大学,スタンダード3/後期,大手町プレイス ホール＆カンファレンス,千代田区大手町2-3-1 大手町プレイス（イーストタワー）1F/2F,
2026/02/03,東京都,大学,立命館大学,一般選抜（試験地）,大手町プレイスホール＆カンファレンス,千代田区大手町2-3-1 大手町プレイス（イーストタワー）1F/2F,
2026/02/03,千葉県,大学,千葉工業大学,本学試験場（津田沼超過時）,新習志野キャンパス,千葉県習志野市芝園2-1-1,
2026/02/03,千葉県,大学,東京農業大学,一般選抜A・B日程,河合塾 津田沼校（津田沼会場）,千葉県習志野市谷津1-15-33,
2026/02/03,千葉県,大学,千葉工業大学,A/SA/B/SB/C日程 本学試験場,津田沼キャンパス,千葉県習志野市津田沼2-17-1,
2026/02/03,千葉県,大学,東京情報大学,一般・総合・推薦・留学生ほか,東京情報大学キャンパス,千葉県千葉市若葉区御成台4-1,
2026/02/03,千葉県,大学,関東学院大学,一般前期A（2/3のみ）,河合塾 千葉現役館,千葉県千葉市中央区新町17-13,
2026/02/03,千葉県,大学,淑徳大学,一般選抜A,千葉試験場（淑徳大学 千葉キャンパス）,千葉県千葉市中央区大巌寺町200,
2026/02/03,千葉県,大学,立正大学,一般選抜2月前期（2/3-5）,千葉会場（千葉市文化センター）,千葉県千葉市中央区中央2-5-1,
2026/02/03,千葉県,大学,芝浦工業大学,一般選抜（前期/全学統一）,千葉会場（TKPガーデンシティ千葉）,千葉県千葉市中央区問屋町1-45千葉ポートスクエア内,
2026/02/03,千葉県,大学,成蹊大学,E方式・P方式独自試験,千葉会場　幕張メッセ 国際会議場,千葉県千葉市美浜区中瀬2-1,
2026/02/03,千葉県,大学,順天堂大学,薬学S日程・医学部一次,幕張メッセ,千葉県千葉市美浜区中瀬2-1,
2026/02/03,千葉県,大学,医療創生大学,国際看護 一般・推薦・社会人特別,医療創生大学 柏キャンパス,千葉県柏市小青田1-3-4,
2026/02/03,千葉県,大学,東京情報大学,一般選抜Ⅰ期A/B,柏会場（貸し会議室 kouwa）,千葉県柏市柏4-5-10,
2026/02/03,千葉県,大学,立正大学,一般選抜2月前期（2/3-5）,柏会場（駿台予備学校柏校）,千葉県柏市柏5-2-13,
2026/02/03,千葉県,大学,清和大学,一般選抜 I期・II期,本学キャンパス,千葉県木更津市東太田3丁目4-5,
2026/02/03,千葉県,大学,東京理科大学,一般選抜B・S方式,野田試験場（野田キャンパス）,千葉県野田市山崎2641,
2026/02/03,神奈川県,大学,東京電機大学,一般選抜 前期/英語外部/情報系外部,川崎市コンベンションホール,川崎市中原区小杉町2丁目276番地1,
2026/02/03,長野県,大学,松本歯科大学,一般選抜Ⅰ期・Ⅱ期・Ⅲ期,松本歯科大学（創立30年記念棟）,長野県塩尻市広丘郷原1780,
2026/02/03,長野県,大学,高崎健康福祉大学,一般A日程,南松ホール,長野県松本市双葉18-22,
2026/02/03,長野県,大学,中部学院大学,,松本会場,長野県松本市中央1-18-1,
2026/02/03,長野県,大学,日本福祉大学,一般入学試験 前期・中期,松本会場（長野県理容会館）,長野県松本市中央1-21-3,
2026/02/03,長野県,大学,福井工業大学,一般Ⅰ期・Ⅱ期/推薦Ⅰ・Ⅱ期,長野県教育会館,長野県長野市旭町1098,
2026/02/03,長野県,大学,開志専門職大学,一般選抜,長野県教育会館,長野県長野市旭町1098,
2026/02/03,長野県,大学,立正大学,一般選抜2月前期（2/3のみ）,長野会場（シャトレーゼホテル長野）,長野県長野市七瀬1-1,
2026/02/03,長野県,大学,関東学院大学,給費生/一般前期A,長野市生涯学習センター,長野県長野市大字鶴賀問御所町1271-3,
2026/02/03,長野県,大学,千葉工業大学,A/SA日程サテライト,長野試験場（JA長野県ビル アクティーホール）,長野県長野市大字南長野北石堂町1177-3,
2026/02/03,長野県,大学,國學院大学,一般選抜A日程（地方会場）,長野会場（長野ターミナル会館）,長野県長野市中御所岡田178-2,
2026/02/03,長野県,大学,日本福祉大学,一般入学試験 前期,長野会場（長野ターミナル会館）,長野県長野市中御所岡田178-2,
2026/02/03,長野県,大学,金沢星稜大学,推薦等・一般A日程,長野会場（ホテルメトロポリタン長野）,長野県長野市南石堂町1346,
