日付,都道府県,学校種,学校名,試験名,試験地,住所,時間
2026/02/03,長野県,大学,群馬医療福祉大学,一般選抜 前期,長野会場,長野県長野市南長野末広町1356 相鉄フレッサイン長野駅善光寺口,
2026/02/03,長野県,大学,高崎健康福祉大学,一般A日程,長野予備学校,長野県長野市北石堂町1022,
2026/02/03,長野県,大学,上武大学,一般選抜 全学統一,長野会場（ホテルＪＡＬシティ長野）,長野県長野市問御所町1221,
2026/02/03,長野県,大学,星城大学,一般選抜前期Aのみ,飯田会場,長野県飯田市錦町1-10,
2026/02/03,長野県,大学,日本福祉大学,一般入学試験 前期,飯田会場（丘の上結いスクエア　ムトスぷらざ）,長野県飯田市東和町2丁目35番地,
2026/02/03,長野県,大学,山梨学院大学,一般選抜（個別）前期,長野会場　長野市生涯学習センター,長野市大字鶴賀問御所町1271-3,
2026/02/03,長野県,大学,玉川大学,全学統一等（2/2-2/3のみ）,長野会場（JA 長野県ビル）,長野市大字南長野北石堂町1177-3,
2026/02/03,長野県,大学,東京電機大学,一般選抜 前期/英語外部/情報系外部,JA長野県ビル,長野市北石堂町1177-3,
2026/02/03,三重県,大学,名城大学,一般選抜 地区別会場,津第一ビル,津市羽所町345,
2026/02/03,三重県,大学,名城大学,一般選抜 地区別会場,ホテルグリーンパーク津,津市羽所町700,
2026/02/03,三重県,大学,名城大学,一般選抜 地区別会場,津商工会館,津市丸之内29-14,
2026/02/03,三重県,大学,立命館アジア太平洋大学,スタンダード3,メッセウイングNHW（津市産業・スポーツセンター）,津市北河路町19-1,
2026/02/03,三重県,大学,立命館大学,一般選抜（試験地）,メッセウイングNHW（津市産業・スポーツセンター）,津市北河路町19-1,
2026/02/03,東京都,大学,東京理科大学,一般選抜B・S方式,葛飾試験場（葛飾キャンパス）,東京都葛飾区新宿6-3-1,
2026/02/03,東京都,大学,芝浦工業大学,一般選抜（前期/全学統一）,豊洲キャンパス,東京都江東区豊洲3-7-5,
2026/02/03,東京都,大学,東海大学,医学部一般選抜1次,TOC有明（コンベンションホール）,東京都江東区有明3-5-7,
2026/02/03,東京都,大学,中京大学,一般前期A/M・後期F／総合型・推薦,TKP品川港南口会議室,東京都港区港南2-4-3 三和港南ビル4階,
2026/02/03,東京都,大学,神戸学院大学,一般(前/中期),東京会場（TKP品川カンファレンスセンターANNEX）,東京都港区高輪3-13-1,
2026/02/03,東京都,大学,吉備国際大学,一般前期AⅠ/AⅡ/B/C,東京会場（TKP品川カンファレンスセンター）,東京都港区高輪3-25-23,
2026/02/03,東京都,大学,九州医療科学大学,一般選抜前期,TKP品川カンファレンスセンター,東京都港区高輪3丁目25番23号 京急第2ビル,
2026/02/03,東京都,大学,日本赤十字北海道看護大学,一般型選抜,TKP品川カンファレンスセンター,東京都港区高輪3丁目25番23号 京急第2ビル10階,
2026/02/03,東京都,大学,東北福祉大学,A日程統一・分割,東京グランドホテル,東京都港区芝2-5-2,
2026/02/03,東京都,大学,明治学院大学,一般選抜：全学部日程・A日程・B日程,白金キャンパス,東京都港区白金台1-2-37,
2026/02/03,東京都,大学,関西学院大学,全日程（一般/個別/英数/共通併用）,代々木ゼミナール本部校 代ゼミタワー,東京都渋谷区代々木2-25-7,
2026/02/03,東京都,大学,國學院大学,一般選抜A日程・B日程,渋谷キャンパス,東京都渋谷区東四丁目10-28,
2026/02/03,東京都,大学,嘉悦大学,一般選抜（独自試験型）,嘉悦大学（本学キャンパス）,東京都小平市花小金井南町2-8-4,
2026/02/03,東京都,大学,東京富士大学,一般・総合・推薦・特別等の全選抜,本学キャンパス（本館）,東京都新宿区高田馬場3-8-1,
2026/02/03,東京都,大学,東京理科大学,一般選抜B・S方式,神楽坂試験場（神楽坂キャンパス）,東京都新宿区神楽坂1-3,
2026/02/03,東京都,大学,山梨学院大学,一般選抜（個別）前期・一部2/6,東京会場　TKP飯田橋ビジネスセンター,東京都新宿区西五軒町3-2,
2026/02/03,東京都,大学,東京都市大学,一般選抜 前期(2/1-2/3)・中期,本学会場（世田谷キャンパス）,東京都世田谷区玉堤1-28-1,
2026/02/03,東京都,大学,東京農業大学,一般選抜A・B日程,世田谷キャンパス（本学会場）,東京都世田谷区桜丘1-1-1,
2026/02/03,東京都,大学,松本歯科大学,一般選抜Ⅰ期・Ⅱ期・Ⅲ期,トラストシティカンファレンス・丸の内,東京都千代田区丸の内1-8-1 丸の内トラストタワーN館 11階,
2026/02/03,東京都,大学,北海道文教大学,一般選抜A日程 東京会場,アルカディア市ケ谷 私学会館,東京都千代田区九段北4-2-25,
2026/02/03,東京都,大学,群馬医療福祉大学,一般選抜 前期,東京会場,東京都千代田区九段北4-2-25 アルカディア市ヶ谷,
2026/02/03,東京都,大学,二松学舎大学,一般選抜S/A/B/E/G・D方式,九段キャンパス,東京都千代田区三番町6-16,
2026/02/03,東京都,大学,関東学院大学,給費生/一般前期A,連合会館,東京都千代田区神田駿河台3-2-11,
2026/02/03,東京都,大学,関西大学,,TKP新橋カンファレンスセンター,東京都千代田区内幸町1丁目3-1 新幸橋ビルディング,
2026/02/03,東京都,大学,上武大学,一般選抜 全学統一,東京会場（都市センターホテル）,東京都千代田区平河町2-4-1,
2026/02/03,東京都,大学,東京電機大学,一般選抜 前期/英語外部/情報系外部/後期,東京千住キャンパス,東京都足立区千住旭町5番,
2026/02/03,東京都,大学,湘南工科大学,一般選抜（全学部統一・S・前期）,東京会場（AP秋葉原）,東京都台東区秋葉原1-1 秋葉原ビジネスセンター 1F・4F・5F（受付1F）,
2026/02/03,東京都,大学,徳島文理大学,一般入試会場（詳細要項参照）,東京都会場　AP東京八重洲,東京都中央区京橋1-10-7,
2026/02/03,東京都,大学,京都先端科学大学,公募推薦A、一般A・B,ビジョンセンター東京 京橋,東京都中央区京橋3-7-1 相互館110タワー4F・8F,
2026/02/03,東京都,大学,高崎健康福祉大学,一般A・B日程,ビジョンセンター東京八重洲,東京都中央区日本橋2-3-4 日本橋プラザビル9F,
2026/02/03,東京都,大学,福井工業大学,一般Ⅰ期/推薦Ⅰ期/留学生Ⅰ期,AP日本橋,東京都中央区日本橋3-6-2 日本橋フロント6F,
2026/02/03,東京都,大学,東京情報大学,一般選抜Ⅰ期A/B・Ⅱ期,東京会場（TKP東京駅カンファレンスセンター）,東京都中央区八重洲1-8-16,
2026/02/03,東京都,大学,北海道情報大学,一般1期/2期・英語外部・推薦1期,eDCビル（東京）,東京都中野区中野5丁目62番地1号,
2026/02/03,東京都,大学,玉川大学,全学統一/地域創生/給付型/実技本学,本学キャンパス,東京都町田市玉川学園6-1-1,
2026/02/03,東京都,大学,芝浦工業大学,一般選抜（前期/全学統一）,町田会場（町田市文化交流センター）,東京都町田市原町田4-1-14 プラザ町田,
2026/02/03,東京都,大学,創価大学,全学統一・一般前期,創価大学（本学キャンパス）,東京都八王子市丹木町1-236,
2026/02/03,東京都,大学,淑徳大学,一般選抜A,東京試験場（淑徳大学 東京キャンパス）,東京都板橋区前野町2-29-3,
2026/02/03,東京都,大学,金沢医科大学,一般選抜前期 一次,東京会場（TOCビル本館）,東京都品川区西五反田7-22-17,
2026/02/03,東京都,大学,立正大学,一般選抜R方式・2月前期・後期・3月,品川キャンパス,東京都品川区大崎4-2-16,
2026/02/03,東京都,大学,京都光華大学,一般前期A・B,きゅりあん（品川区立総合区民会館）,東京都品川区東大井5-18-1,
2026/02/03,東京都,大学,成蹊大学,A方式・E方式・P方式実施,成蹊大学（東京・吉祥寺）,東京都武蔵野市吉祥寺北町3-3-1,
2026/02/03,東京都,大学,亜細亜大学,一般入試/全学統一(前中後)/DS後期,武蔵野キャンパス,東京都武蔵野市境5-8,
2026/02/03,東京都,大学,文京学院大学,全学統一選抜・一般選抜I〜III期,本郷キャンパス,東京都文京区向丘1-19-1,
2026/02/03,東京都,大学,拓殖大学,2月前期選抜A･B･C日程,文京キャンパス,東京都文京区小日向3-4-14,
2026/02/03,東京都,大学,東京農業大学,一般選抜A日程,河合塾 池袋校 西館（池袋会場）,東京都豊島区西池袋1-3-12,
2026/02/03,東京都,大学,開志専門職大学,一般選抜,TKP池袋カンファレンスセンター,東京都豊島区南池袋2-22-1 第3高村ビル5～6階,
2026/02/03,東京都,大学,札幌学院大学,一般A日程。2/4は留学生B実施,北京語言大学東京校,東京都豊島区南池袋2-29-14,
2026/02/03,東京都,大学,東京成徳大学,一般選抜A・B・C・D日程,東京成徳大学,東京都北区十条台1-7-13,
2026/02/03,東京都,大学,千葉工業大学,A/SA・B/SB日程サテライト,東京スカイツリータウン®キャンパス試験場,東京都墨田区押上1-1-2 東京スカイツリータウン® 8階,
2026/02/03,東京都,大学,東京農業大学,一般選抜A日程,me:rise立川 Conference Room（立川会場）,東京都立川市曙町2-8-28 TAMA MIRAI SQUARE,
2026/02/03,神奈川県,大学,東京電機大学,一般選抜 前期/英語外部/情報系外部,藤沢商工会議所,藤沢市藤沢607-1,
2026/02/03,栃木県,大学,立正大学,一般選抜2月前期（2/3のみ）,宇都宮会場（TKP宇都宮カンファレンスセンター）,栃木県宇都宮市駅前通り1-3-1 KDX宇都宮ビル地下1階,
2026/02/03,栃木県,大学,千葉工業大学,A/SA・B/SB日程サテライト,宇都宮試験場（ライトキューブ宇都宮）,栃木県宇都宮市宮みらい1-20,
2026/02/03,栃木県,大学,東京農業大学,一般選抜A日程,ライトキューブ宇都宮（宇都宮会場）,栃木県宇都宮市宮みらい1-20,
2026/02/03,栃木県,大学,淑徳大学,一般選抜A,宇都宮試験場（ライトキューブ宇都宮）,栃木県宇都宮市宮みらい1-20,
2026/02/03,栃木県,大学,上武大学,一般選抜 全学統一,宇都宮会場（ホテルマイステイズ宇都宮）,栃木県宇都宮市東宿郷2-4-1,
2026/02/03,栃木県,大学,高崎健康福祉大学,一般A日程,ホテルマイステイズ宇都宮,栃木県宇都宮市東宿郷2-4-1,
2026/02/03,栃木県,大学,群馬医療福祉大学,一般選抜 前期,宇都宮会場,栃木県宇都宮市東宿郷2-4-1 ホテルマイステイズ宇都宮,
2026/02/03,千葉県,大学,立命館アジア太平洋大学,スタンダード3/英語重視/共テ+英・国,柏の葉カンファレンスセンター,柏市若柴178-4 ホテル＆レジデンス棟2階,
2026/02/03,千葉県,大学,立命館大学,一般選抜（試験地）,柏の葉カンファレンスセンター,柏市若柴178-4 ホテル＆レジデンス棟2階,
2026/02/03,千葉県,大学,立命館アジア太平洋大学,スタンダード3/英語重視,ハート柏迎賓館,柏市柏233,
2026/02/03,千葉県,大学,立命館大学,一般選抜（試験地）,ハート柏迎賓館,柏市柏233,
2026/02/03,静岡県,大学,名城大学,一般選抜 地区別会場,プレスタワー17階 静岡新聞ホール,浜松市中央区旭町11-1,
2026/02/03,静岡県,大学,名城大学,一般選抜 地区別会場,えんてつホール,浜松市中央区旭町12-1 遠鉄百貨店新館8階,
2026/02/03,静岡県,大学,金城学院大学,一般選抜前期,浜松会場,浜松市中央区早馬町2番地1,
2026/02/03,静岡県,大学,立命館アジア太平洋大学,スタンダード3/英語重視/共テ+英・国,オークラアクトシティホテル浜松,浜松市中央区板屋町111-2,
2026/02/03,静岡県,大学,立命館大学,一般選抜（試験地）,オークラアクトシティホテル浜松,浜松市中央区板屋町111-2,
2026/02/03,静岡県,大学,名城大学,一般選抜 地区別会場,浜北文化センター,浜松市浜名区貴布祢291-1,
2026/02/03,富山県,大学,金沢星稜大学,推薦等・一般A日程,高岡会場（高岡商工会議所）,富山県高岡市丸の内1-40,
2026/02/03,富山県,大学,金城大学,一般選抜のみ（2/3）,高岡会場（高岡市生涯学習センター）,富山県高岡市末広町1-7 ウイング・ウイング高岡内,
2026/02/03,富山県,大学,福井工業大学,一般Ⅰ期・Ⅱ期,ボルファートとやま,富山県富山市奥田新町8-1,
2026/02/03,富山県,大学,日本福祉大学,一般入学試験 前期・中期,富山会場（インテックビル（タワー111））,富山県富山市牛島新町5番5号,
2026/02/03,富山県,大学,名古屋商科大学,一般前期A,富山会場（富山県民会館）,富山県富山市新総曲輪4-18,
2026/02/03,富山県,大学,金沢星稜大学,推薦等・一般A日程,富山会場（富山県民会館）,富山県富山市新総曲輪4番18号,
2026/02/03,富山県,大学,北陸大学,一般選抜A/B日程,富山商工会議所,富山県富山市総曲輪2-1-3,
2026/02/03,富山県,大学,中京大学,一般前期A/M／総合型・推薦,富山県農協会館,富山市新総曲輪2-21,
2026/02/03,富山県,大学,名城大学,一般選抜 地区別会場,富山県中小企業研修センター,富山市赤江町1-7,
2026/02/03,福井県,大学,福井工業大学,一般Ⅰ期/推薦Ⅰ期,敦賀商工会議所,福井県敦賀市神楽町2丁目1-4,
2026/02/03,福井県,大学,北陸大学,一般選抜A日程,福井県自治会館,福井県福井市開発4-202-1,
2026/02/03,福井県,大学,福井工業大学,全方式（本学実施分）,福井工業大学（福井キャンパス）,福井県福井市学園3丁目6番1号,
2026/02/03,福井県,大学,中京大学,一般前期A/M／総合型・推薦,福井商工会議所ビル,福井県福井市西木田2-8-1,
2026/02/03,福井県,大学,金城大学,推薦(11/16)・一般(2/3),福井会場（フェニックス・プラザ）,福井県福井市田原1丁目13-6,
2026/02/03,福井県,大学,金沢星稜大学,推薦等・一般A日程,福井会場（ユニオンプラザ福井）,福井県福井市問屋町1丁目35番地,
2026/02/03,福井県,大学,立命館アジア太平洋大学,スタンダード3,福井市地域交流プラザ（AOSSA6F）,福井市手寄1-4-1 AOSSA,
2026/02/03,福井県,大学,立命館大学,一般選抜（試験地）,福井市地域交流プラザ（AOSSA6F）,福井市手寄1-4-1 AOSSA,
2026/02/03,福井県,大学,名城大学,一般選抜 地区別会場,福井県繊協ビル,福井市大手3-7-1,
2026/02/03,福島県,大学,医療創生大学,総合型・学校推薦・一般の会場,医療創生大学 いわきキャンパス,福島県いわき市中央台飯野5-5-1,
2026/02/03,福島県,大学,医療創生大学,国際看護 一般（前期）,駿優予備学校 郡山校,福島県郡山市駅前1-12-6,
2026/02/03,福島県,大学,淑徳大学,一般選抜A,郡山試験場（セルフミーティングルーム虎丸）,福島県郡山市虎丸町15-4,
2026/02/03,福島県,大学,東北福祉大学,A日程統一・分割,郡山商工会議所,福島県郡山市清水台1-3-8,
2026/02/03,福島県,大学,開志専門職大学,一般選抜,国際医療看護福祉大学校 ANNEX校舎,福島県郡山市方八町2丁目4番10号,
2026/02/03,東京都,大学,玉川大学,全学統一等（2/2-2/3のみ）,池袋会場（アットビジネスセンター池袋駅前別館）,豊島区東池袋1-6-4伊藤ビル,
2026/02/03,北海道,大学,星槎道都大学,旭川会場,星槎国際高等学校 旭川学習センター,北海道旭川市2条通11丁目237-1,
2026/02/03,北海道,大学,北海道情報大学,一般1期/英語外部・推薦1期,旭川北洋ビル,北海道旭川市4条通9丁目1703番地,
2026/02/03,北海道,大学,札幌学院大学,一般A・B日程,旭川ときわ市民ホール,北海道旭川市5条通4丁目,
2026/02/03,北海道,大学,日本赤十字北海道看護大学,一般型選抜,旭川市大雪クリスタルホール,北海道旭川市神楽3条7丁目,
2026/02/03,北海道,大学,札幌学院大学,一般A日程,釧路ロイヤルイン,北海道釧路市黒金町14丁目9番2号,
2026/02/03,北海道,大学,日本赤十字北海道看護大学,一般型選抜,道東経済センタービル,北海道釧路市大町1-1-1 道東経済センタービル3階,
2026/02/03,北海道,大学,北海道文教大学,本学会場（一般選抜A日程）,北海道文教大学（恵庭キャンパス）,北海道恵庭市黄金中央5丁目196番地の1,
2026/02/03,北海道,大学,北海道情報大学,総合型特別/起業AO・推薦・一般,本学（北海道情報大学）,北海道江別市西野幌59番2,
2026/02/03,北海道,大学,札幌学院大学,本学会場。全入試実施,江別キャンパス（本学会場）,北海道江別市文京台11番地,
2026/02/03,北海道,大学,東京農業大学,一般選抜A日程,TKPガーデンシティ札幌駅前（札幌会場）,北海道札幌市中央区北2条西2-19 TKP札幌ビル,
2026/02/03,北海道,大学,日本福祉大学,一般入学試験 前期,札幌会場（ACU-A アスティ45）,北海道札幌市中央区北4条西5丁目アスティ45,
2026/02/03,北海道,大学,芝浦工業大学,一般選抜（前期/全学統一）,札幌会場（TKP札幌ビジネスセンター赤れんが前）,北海道札幌市中央区北4条西6丁目1,
2026/02/03,北海道,大学,國學院大学,一般選抜A日程（地方会場）,札幌会場（代々木ゼミナール札幌校）,北海道札幌市北区北7条西2-5,
2026/02/03,北海道,大学,東京理科大学,一般選抜B・S方式,札幌試験場（代々木ゼミナール札幌校）,北海道札幌市北区北7条西2-5,
2026/02/03,北海道,大学,立正大学,一般選抜2月前期（2/3のみ）,札幌会場（代々木ゼミナール札幌校）,北海道札幌市北区北7条西2-5,
2026/02/03,北海道,大学,日本赤十字北海道看護大学,一般型選抜,TKP札幌駅カンファレンスセンター,北海道札幌市北区北7条西2丁目9 ベルヴュオフィス札幌 3階,
2026/02/03,北海道,大学,札幌学院大学,一般A日程,FKホールディングス 生涯学習センター きらん,北海道室蘭市中島町2丁目22-1,
2026/02/03,北海道,大学,北海道情報大学,一般1期/英語外部,ホテルグランテラス帯広,北海道帯広市西1条南11丁目2番地,
2026/02/03,北海道,大学,北海道文教大学,一般選抜A日程 帯広会場,とかちプラザ,北海道帯広市西4条南13丁目1,
2026/02/03,北海道,大学,札幌学院大学,一般A日程,道新ホール帯広,北海道帯広市西4条南9丁目1-4,
2026/02/03,北海道,大学,日本赤十字北海道看護大学,一般型選抜,ソネビル本館,北海道帯広市西6条南6丁目3番地3階,
2026/02/03,北海道,大学,星槎道都大学,帯広会場,とかち館,北海道帯広市西7条南6丁目2番地,
2026/02/03,北海道,大学,星槎道都大学,函館会場,サン・リフレ函館,北海道函館市大森町2番14号,
2026/02/03,北海道,大学,日本赤十字北海道看護大学,一般型選抜,サン・リフレ函館,北海道函館市大森町2番14号2階,
2026/02/03,北海道,大学,札幌学院大学,一般A日程,函館市民会館,北海道函館市湯川町1-32-1,
2026/02/03,北海道,大学,北海道情報大学,一般1期/英語外部・推薦1期,ホテル法華クラブ函館,北海道函館市本町27-1,
2026/02/03,北海道,大学,日本赤十字北海道看護大学,総合型/推薦Ⅰ/推薦Ⅱ/社会人/一般,日本赤十字北海道看護大学,北海道北見市曙町664番地1,
2026/02/03,北海道,大学,札幌学院大学,一般A日程,中高年齢労働者福祉センター サンライフ北見,北海道北見市東三輪5丁目1番地16,
2026/02/03,北海道,大学,星槎道都大学,本学会場,星槎道都大学,北海道北広島市中の沢149番地,
2026/02/03,北海道,大学,東京農業大学,一般選抜A・B日程,北海道オホーツクキャンパス（本学会場）,北海道網走市八坂196,
2026/02/03,愛知県,大学,立命館アジア太平洋大学,スタンダード3/英語重視,愛知県武道館,名古屋市港区丸池町1-1-4,
2026/02/03,愛知県,大学,立命館大学,一般選抜（試験地）,愛知県武道館,名古屋市港区丸池町1-1-4,
2026/02/03,愛知県,大学,福山大学,一般選抜 前期A日程（名古屋）,AP名古屋,名古屋市中区栄4-10-25,
2026/02/03,愛知県,大学,玉川大学,全学統一等（2/2-2/3のみ）,名古屋会場（代々木ゼミナール）,名古屋市中村区則武1-5-7,
2026/02/03,愛知県,大学,神戸学院大学,公募推薦・一般(前/中/後期),名古屋会場（安保ホール）,名古屋市中村区名駅3-15-9,
2026/02/03,愛知県,大学,創価大学,全学統一・一般前期・後期CBT,愛知会場,名古屋市中村区名駅3丁目25-3,
2026/02/03,愛知県,大学,立命館アジア太平洋大学,スタンダード3/英語重視/共テ+英・国/後期,愛知県産業労働センター（ウインクあいち）,名古屋市中村区名駅4-4-38,
2026/02/03,愛知県,大学,立命館大学,一般選抜（試験地）,愛知県産業労働センター（ウインクあいち）,名古屋市中村区名駅4-4-38,
2026/02/03,愛知県,大学,名城大学,一般選抜 名古屋会場,天白キャンパス,名古屋市天白区塩釜口一丁目501番地,
2026/02/03,愛知県,大学,名城大学,一般選抜 名古屋会場,八事キャンパス,名古屋市天白区八事山152,
2026/02/03,愛知県,大学,名城大学,一般選抜 名古屋会場,ナゴヤドーム前キャンパス,名古屋市東区矢田南4-102-11,
2026/02/03,東京都,大学,玉川大学,全学統一等（2/2-2/3のみ）,立川会場（駿台予備学校立川校）,立川市柴崎町3-5-17,
2026/02/03,三重県,大学,名城大学,一般選抜 地区別会場,ホテルグリーンパーク鈴鹿,鈴鹿市白子4-15-20,
2026/02/03,神奈川県,中学校,横浜市立高等学校附属中学校,,本校,神奈川県横浜市港南区東永谷2丁目1-1,
2026/02/03,東京都,中学校,都立大泉高等学校附属中学校,,本校,東京都練馬区東大泉5丁目3-1,
2026/02/03,東京都,,東京都立足立特別支援学校,,,東京都足立区花畑7丁目23番15号,
2026/02/03,東京都,,東京都立八王子西特別支援学校,,,東京都八王子市東浅川町546-1,
2026/02/03,千葉県,追試験,筑波大学附属聴覚特別支援学校,,,千葉県市川市国府台2-2-1,
2026/02/03,東京都,入学説明会,東京都立葛飾ろう学校小学部,,,東京都葛飾区西亀有2-58-1,
2026/02/03,愛知県,大学,名古屋外国語大学,一般選抜前期Ａ方式,名古屋外国語大学　日進キャンパス,愛知県日進市岩崎町竹ノ山57,
2026/02/03,愛知県,大学,麻布大学,一般入学試験（第Ⅰ期）B日程,名古屋サンスカイルーム,愛知県名古屋市中区錦1丁目18-22 名古屋ATビル2F,
2026/02/03,愛知県,大学,国士舘大学,デリバリー選抜,名古屋会場（安保ホール）,愛知県名古屋市中村区名駅3-15-9,
2026/02/03,愛知県,大学,東海学院大学,,名古屋,愛知県名古屋市中村区名駅4-5-27 大一名駅 3階,
2026/02/03,茨城県,大学,国士舘大学,デリバリー選抜,水戸会場（水戸駿優予備学校本部）,茨城県水戸市三の丸1-1-42,
2026/02/03,茨城県,大学,桜美林大学,一般選抜前期,水戸会場（三の丸ホテル）,茨城県水戸市三の丸2-1-1,
2026/02/03,岐阜県,大学,愛知学院大学,,岐阜,岐阜市鶴舞町2丁目6-7,
2026/02/03,宮城県,大学,桜美林大学,一般選抜前期,仙台会場（TKP仙台青葉通カンファレンスセンター,宮城県仙台市青葉区一番町2-4-1 青葉通パークビルディング,
2026/02/03,宮城県,大学,城西大学,一般選抜A日程,宮城会場（TKPガーデンシティPREMIUM仙台西口）,宮城県仙台市青葉区花京院1-2-15ソララプラザ,
2026/02/03,宮城県,大学,国士舘大学,デリバリー選抜,仙台会場（ショーケー本館ビル）,宮城県仙台市青葉区五橋2-11-1,
2026/02/03,宮城県,大学,麻布大学,一般入学試験（第Ⅰ期）B日程,秀英予備校　仙台本部校,宮城県仙台市青葉区堤通雨宮町3-23,
2026/02/03,石川県,大学,愛知学院大学,,金沢,金沢市堀川新町7-1,
2026/02/03,群馬県,大学,国士舘大学,デリバリー選抜,高崎会場（小野池學院）,群馬県高崎市栄町15-3,
2026/02/03,群馬県,大学,東海大学,全学部統一前期,高崎,群馬県高崎市栄町22-30,
2026/02/03,埼玉県,大学,国士舘大学,デリバリー選抜,大宮会場（大宮ソニックシティビル）,埼玉県さいたま市大宮区桜木町1-7-5,
2026/02/03,埼玉県,大学,麻布大学,一般入学試験（第Ⅰ期）B日程,JA共済埼玉ビル,埼玉県さいたま市大宮区土手町1-2,
